{
  "name": "nxsh-retro",
  "version": "1.0.0",
  "author": "NexusShell Team",
  "description": "80s retro computer terminal colors",
  "colors": {
    "primary": "#00ffff",
    "secondary": "#ff00ff",
    "accent": "#ffff00",
    "background": "#000080",
    "foreground": "#00ffff",
    "error": "#ff0000",
    "warning": "#ffff00",
    "success": "#00ff00",
    "info": "#00ffff",
    "muted": "#ff00ff",
    "highlight": "#ffff00",
    "border": "#800080"
  },
  "styles": {
    "prompt": {
      "foreground": "Blue",
      "bold": true
    },
    "command": {
      "foreground": "White"
    },
    "error": {
      "foreground": "Red",
      "bold": true
    },
    "warning": {
      "foreground": "Yellow"
    },
    "success": {
      "foreground": "Green",
      "bold": true
    }
  }
}