{
  "name": "nxsh-solarized-light",
  "version": "1.0.0",
  "author": "NexusShell Team",
  "description": "Light variant of Solarized color scheme",
  "colors": {
    "primary": "#268bd2",
    "secondary": "#93a1a1",
    "accent": "#cb4b16",
    "background": "#fdf6e3",
    "foreground": "#657b83",
    "error": "#dc322f",
    "warning": "#b58900",
    "success": "#859900",
    "info": "#268bd2",
    "muted": "#93a1a1",
    "highlight": "#d33682",
    "border": "#eee8d5"
  },
  "styles": {
    "prompt": {
      "foreground": "Blue",
      "bold": true
    },
    "command": {
      "foreground": "White"
    },
    "error": {
      "foreground": "Red",
      "bold": true
    },
    "warning": {
      "foreground": "Yellow"
    },
    "success": {
      "foreground": "Green",
      "bold": true
    }
  }
}