{
  "name": "nxsh-autumn",
  "version": "1.0.0",
  "author": "NexusShell Team",
  "description": "Warm autumn colors",
  "colors": {
    "primary": "#d2691e",
    "secondary": "#8b4513",
    "accent": "#ffd700",
    "background": "#2f1b14",
    "foreground": "#f5deb3",
    "error": "#b22222",
    "warning": "#daa520",
    "success": "#9acd32",
    "info": "#d2691e",
    "muted": "#8b4513",
    "highlight": "#ffd700",
    "border": "#654321"
  },
  "styles": {
    "prompt": {
      "foreground": "Blue",
      "bold": true
    },
    "command": {
      "foreground": "White"
    },
    "error": {
      "foreground": "Red",
      "bold": true
    },
    "warning": {
      "foreground": "Yellow"
    },
    "success": {
      "foreground": "Green",
      "bold": true
    }
  }
}