{
  "name": "nxsh-gruvbox-dark",
  "version": "1.0.0",
  "author": "NexusShell Team",
  "description": "Warm and cozy dark theme inspired by Gruvbox",
  "colors": {
    "primary": "#83a598",
    "secondary": "#928374",
    "accent": "#fe8019",
    "background": "#282828",
    "foreground": "#ebdbb2",
    "error": "#fb4934",
    "warning": "#fabd2f",
    "success": "#b8bb26",
    "info": "#83a598",
    "muted": "#928374",
    "highlight": "#d3869b",
    "border": "#3c3836"
  },
  "styles": {
    "prompt": {
      "foreground": "Blue",
      "bold": true
    },
    "command": {
      "foreground": "White"
    },
    "error": {
      "foreground": "Red",
      "bold": true
    },
    "warning": {
      "foreground": "Yellow"
    },
    "success": {
      "foreground": "Green",
      "bold": true
    }
  }
}