{
  "name": "nxsh-winter",
  "version": "1.0.0",
  "author": "NexusShell Team",
  "description": "Cool winter theme with icy blues",
  "colors": {
    "primary": "#4169e1",
    "secondary": "#6495ed",
    "accent": "#87ceeb",
    "background": "#0f1419",
    "foreground": "#f0f8ff",
    "error": "#b22222",
    "warning": "#daa520",
    "success": "#32cd32",
    "info": "#4169e1",
    "muted": "#6495ed",
    "highlight": "#87ceeb",
    "border": "#2f4f4f"
  },
  "styles": {
    "prompt": {
      "foreground": "Blue",
      "bold": true
    },
    "command": {
      "foreground": "White"
    },
    "error": {
      "foreground": "Red",
      "bold": true
    },
    "warning": {
      "foreground": "Yellow"
    },
    "success": {
      "foreground": "Green",
      "bold": true
    }
  }
}